{
  "id": "romans-3-24-dikaioo-forensic",
  "statement": "In Romans 3:24, the verb δικαιόω (\"dikaioumenoi\" / \"being justified\") is used primarily in a forensic, declarative sense (God's legal declaration of righteousness), rather than in a primarily transformative or intrinsic-renewal sense.",
  "passages": [
    {
      "reference": "Rom 3:24",
      "original_text": "dikaioumenoi dwrean th autou cariti dia thv apolutrwsewv thv en cristw ihsou",
      "original_language": "greek",
      "translations": {
        "KJV-1769": "Being justified freely by his grace through the redemption that is in Christ Jesus:"
      }
    },
    {
      "reference": "Rom 3:21-26",
      "original_text": "nuni de cwriv nomou dikaiosunh yeou pefanerwtai marturoumenh upo tou nomou kai twn profhtwn ... dikaioumenoi dwrean th autou cariti dia thv apolutrwsewv thv en cristw ihsou ... eiv to einai auton dikaion kai dikaiounta ton ek pistewv ihsou",
      "original_language": "greek",
      "translations": {
        "KJV-1769": "But now the righteousness of God without the law is manifested, being witnessed by the law and the prophets; ... Being justified freely by his grace through the redemption that is in Christ Jesus: ... To declare, I say, at this time his righteousness: that he might be just, and the justifier of him which believeth in Jesus."
      }
    }
  ],
  "profile_dependency": null,
  "debate_history": [],
  "resolution_status": "unresolved",
  "stability_score": 0.0,
  "contestation_score": 0.0,
  "version_history": [
    {
      "commit_sha": "TBD",
      "timestamp": "2026-04-09T00:00:00Z",
      "note": "Initial creation of atomic claim definition for Romans 3:24 δικαιόω (forensic vs. transformative sense) using TR-Scrivener-1894 and KJV-1769 Romans 3 corpora.",
      "author_model": "openai/gpt-5.1"
    }
  ]
}
